{"asset_sha256":{"devices/portrait/base.png":"8f72602fd1067b27577af2a328cb2709f43c4c00fd29c25a370114edaff470f1","devices/portrait/rain.png":"d8d79dbb742735f9ae727e898e9b3b68feae26d52db6ea20a59182da869cff91"},"at":"2026-10-31T10:05:00Z","device":"portrait","drawing_key":"3e00bf59bbc23db3902464421b25f066f5e37eecbc24ed91d77e9c0e0fd5cf69","history_url":"dynamic/test-theme/devices/portrait/states/6179b32c8f08690190a34cac96654e5ab5d5cfec305c7835b03a229b925c9083/2026-10-31.json","id":"dc17704749be6724554077be5341fc9773b3a79a99d5342867bc1d018ab1e54c","image":{"bytes":633,"format":"jpg","height":9,"sha256":"354cb2620eec6159569d439c47a05dab9b1c86c2fbc4068ac56390cf17bde562","url":"dynamic/test-theme/devices/portrait/current.jpg","width":5},"inputs":{"active":["season.autumn","time.day","weather.rain","game.neutral"],"at":"2026-10-31T10:05:00Z","derived":{"life_slot":null},"device":"portrait","schema_version":"0.2","sun":{},"weather":{}},"life":{"base_key":"087803e2142bd0d4ce430b5f30c02ad7000bb655c925c84c5d917d07e4d57493","blocked_hour_start":"2026-10-31T10:00:00.000000Z","hour_start":"2026-10-31T10:00:00.000000Z","previous":null,"reason":"first_build","renderer_version":"pillow-source-over-srgb/1","request_key":"389e4c5d966c1eddea8f16483e411b854ad406ab966a3bf3b301076a02b29c9b","source_context":"real:b243841ff97d424de131be7ebae6107df22384656e78e4682daa1336eda73f89","timezone":"Europe/Moscow"},"preview":{"bytes":632,"format":"jpg","height":9,"sha256":"11627bb9d00adc97b7e0d1ffc0da6b8511030fe1b3868e9bed9b3593271abbb2","url":"dynamic/test-theme/devices/portrait/current-preview.jpg","width":5},"provenance":{"weather":{"fetched_at":"2026-10-31T10:05:00Z"}},"recipe":{"device":"portrait","height":9,"layers":[{"asset":"base","file":"devices/portrait/base.png","id":"base","opacity":1,"order":0},{"asset":"rain","file":"devices/portrait/rain.png","id":"rain","opacity":0.5,"order":20}],"schema_version":"0.2","theme_id":"test-theme","width":5},"renderer":{"color_space":"sRGB","contract":"0.2","engine":"pillow-alpha-composite","jpeg":"6.2","opacity":"alpha=round_half_up(alpha*opacity)","optimize":false,"pillow":"12.3.0","progressive":false,"quality":90,"subsampling":0},"schema":1,"schema_version":"0.2","state_archive":"dynamic/test-theme/devices/portrait/states.zip","theme_archive":"downloads/theme-test-theme-portrait.zip","theme_id":"test-theme","type":"dynamic-state","valid_until":"2026-10-31T11:05:00+00:00"}
