{"asset_sha256":{"devices/landscape/base.png":"daa3c1baeef060e741574b22fe0aef903dbec81e165af151535af6c0221d0bb8","devices/landscape/rain.png":"4b5d36068854991b4dce8f8d67c6a550e9341a111d15f1ae4a87d4ab24f551ba"},"at":"2026-10-31T10:05:00Z","device":"landscape","drawing_key":"f18089a9ec6df0a8ba80e9ff9df28d7b135a83cadf49ecbf6632ce7b09128681","history_url":"dynamic/test-theme/devices/landscape/states/3801bec123c9c5def7df4c0fe69f5f8219ee9771cbc22988f0308145f20d53e3/2026-10-31.json","id":"2eb84c5484d9b63ab34e842840956471aa30b3ee0b6094a8d45981845d5d79d0","image":{"bytes":632,"format":"jpg","height":6,"sha256":"951c01b22b75ce80080ffc5e54f47cdc5aa1d04798b1ba518fddc49be72e8afd","url":"dynamic/test-theme/devices/landscape/current.jpg","width":8},"inputs":{"active":["season.autumn","time.day","weather.rain","game.neutral"],"at":"2026-10-31T10:05:00Z","derived":{"life_slot":null},"device":"landscape","schema_version":"0.2","sun":{},"weather":{}},"life":{"base_key":"4a4ae862b8a7c940c88e7e3679fabdc58fcc787933bb7b2407c645c2cebb9dce","blocked_hour_start":"2026-10-31T10:00:00.000000Z","hour_start":"2026-10-31T10:00:00.000000Z","previous":null,"reason":"first_build","renderer_version":"pillow-source-over-srgb/1","request_key":"497408969a6262d43c7f9e60162552406bbbe3850863526e13b2f8833947fbd7","source_context":"real:b243841ff97d424de131be7ebae6107df22384656e78e4682daa1336eda73f89","timezone":"Europe/Moscow"},"preview":{"bytes":631,"format":"jpg","height":6,"sha256":"cc15654db9dd4a5a5f3e731d89998c512bc4ad160e6c9af2796315c4405de91b","url":"dynamic/test-theme/devices/landscape/current-preview.jpg","width":8},"provenance":{"weather":{"fetched_at":"2026-10-31T10:05:00Z"}},"recipe":{"device":"landscape","height":6,"layers":[{"asset":"base","file":"devices/landscape/base.png","id":"base","opacity":1,"order":0},{"asset":"rain","file":"devices/landscape/rain.png","id":"rain","opacity":0.5,"order":20}],"schema_version":"0.2","theme_id":"test-theme","width":8},"renderer":{"color_space":"sRGB","contract":"0.2","engine":"pillow-alpha-composite","jpeg":"6.2","opacity":"alpha=round_half_up(alpha*opacity)","optimize":false,"pillow":"12.3.0","progressive":false,"quality":90,"subsampling":0},"schema":1,"schema_version":"0.2","state_archive":"dynamic/test-theme/devices/landscape/states.zip","theme_archive":"downloads/theme-test-theme-landscape.zip","theme_id":"test-theme","type":"dynamic-state","valid_until":"2026-10-31T11:05:00+00:00"}
